"Status","Start Time","Stop Time","Duration in ms","Parent Suite","Suite","Sub Suite","Test Class","Test Method","Name","Description"
"passed","Wed Oct 16 19:53:18 GMT 2024","Wed Oct 16 19:53:32 GMT 2024","13165","Login com credenciais validas","","","","","Login deve ser realizado com sucesso usando credenciais validas",""
"passed","Wed Oct 16 19:52:16 GMT 2024","Wed Oct 16 19:53:16 GMT 2024","60210","Cadastro de produtos","","","","","Realizar cadastro de produto valido informando o vinculo fiscal",""
"passed","Wed Oct 16 19:53:32 GMT 2024","Wed Oct 16 19:53:32 GMT 2024","25","Login com credenciais invalidas","","","","","Login não deve ser realizado e deve ser apresentado uma mensagem informando que as credenciais são inválidas",""
"passed","Wed Oct 16 19:53:36 GMT 2024","Wed Oct 16 19:54:36 GMT 2024","59656","Realizar venda","","","","","Realizar venda com sucesso",""
"passed","Wed Oct 16 19:51:46 GMT 2024","Wed Oct 16 19:52:11 GMT 2024","25756","Cadastro de cliente","","","","","Realizar cadastro de cliente",""
